 seq 5429064:5429284, ack 3421, win 501, length 220
17:50:22.196110 IP lamp-ubuntu-s-1vcpu-1gb-tor1-01.ssh > cpef85e42f6a6ce-cmf85e42f6a6cc.cpe.net.cable.rogers.com.61067: Flags [P.], seq 5429284:5429504, ack 3421, win 501, length 220
17:50:22.196167 IP lamp-ubuntu-s-1vcpu-1gb-tor1-01.ssh > cpef85e42f6a6ce-cmf85e42f6a6cc.cpe.net.cable.rogers.com.61067: Flags [P.], seq 5429504:5429724, ack 3421, win 501, length 220
17:50:22.196221 IP lamp-ubuntu-s-1vcpu-1gb-tor1-01.ssh > cpef85e42f6a6ce-cmf85e42f6a6cc.cpe.net.cable.rogers.com.61067: Flags [P.], seq 5429724:5429944, ack 3421, win 501, length 220
17:50:22.196276 IP lamp-ubuntu-s-1vcpu-1gb-tor1-01.ssh > cpef85e42f6a6ce-cmf85e42f6a6cc.cpe.net.cable.rogers.com.61067: Flags [P.], seq 5429944:5430164, ack 3421, win 501, length 220
17:50:22.196334 IP lamp-ubuntu-s-1vcpu-1gb-tor1-01.ssh > cpef85e42f6a6ce-cmf85e42f6a6cc.cpe.net.cable.rogers.com.61067: Flags [P.], seq 5430164:5430384, ack 3421, win 501, length 220
17:50:22.196388 IP lamp-ubuntu-s-1vcpu-1gb-tor1-01.ssh > cpef85e42f6a6ce-cmf85e42f6a6cc.cpe.net.cable.rogers.com.61067: Flags [P.], seq 5430384:5430604, ack 3421, win 501, length 220
17:50:22.196446 IP lamp-ubuntu-s-1vcpu-1gb-tor1-01.ssh > cpef85e42f6a6ce-cmf85e42f6a6cc.cpe.net.cable.rogers.com.61067: Flags [P.], seq 5430604:5430824, ack 3421, win 501, length 220
17:50:22.196501 IP lamp-ubuntu-s-1vcpu-1gb-tor1-01.ssh > cpef85e42f6a6ce-cmf85e42f6a6cc.cpe.net.cable.rogers.com.61067: Flags [P.], seq 5430824:5431044, ack 3421, win 501, length 220
17:50:22.196555 IP lamp-ubuntu-s-1vcpu-1gb-tor1-01.ssh > cpef85e42f6a6ce-cmf85e42f6a6cc.cpe.net.cable.rogers.com.61067: Flags [P.], seq 5431044:5431264, ack 3421, win 501, length 220
17:50:22.196614 IP lamp-ubuntu-s-1vcpu-1gb-tor1-01.ssh > cpef85e42f6a6ce-cmf85e42f6a6cc.cpe.net.cable.rogers.com.61067: Flags [P.], seq 5431264:5431484, ack 3421, win 501, length 220
17:50:22.196669 IP lamp-ubuntu-s-1vcpu-1gb-tor1-01.ssh > cpef85e42f6a6ce-cmf85e42f6a6cc.cpe.net.cable.rogers.com.61067: Flags [P.], seq 5431484:5431704, ack 3421, win 501, length 220
17:50:22.196723 IP lamp-ubuntu-s-1vcpu-1gb-tor1-01.ssh > cpef85e42f6a6ce-cmf85e42f6a6cc.cpe.net.cable.rogers.com.61067: Flags [P.], seq 5431704:5431924, ack 3421, win 501, length 220
17:50:22.196778 IP lamp-ubuntu-s-1vcpu-1gb-tor1-01.ssh > cpef85e42f6a6ce-cmf85e42f6a6cc.cpe.net.cable.rogers.com.61067: Flags [P.], seq 5431924:5432144, ack 3421, win 501, length 220
17:50:22.196832 IP lamp-ubuntu-s-1vcpu-1gb-tor1-01.ssh > cpef85e42f6a6ce-cmf85e42f6a6cc.cpe.net.cable.rogers.com.61067: Flags [P.], seq 5432144:5432364, ack 3421, win 501, length 220
17:50:22.196885 IP lamp-ubuntu-s-1vcpu-1gb-tor1-01.ssh > cpef85e42f6a6ce-cmf85e42f6a6cc.cpe.net.cable.rogers.com.61067: Flags [P.], seq 5432364:5432584, ack 3421, win 501, length 220
17:50:22.196939 IP lamp-ubuntu-s-1vcpu-1gb-tor1-01.ssh > cpef85e42f6a6ce-cmf85e42f6a6cc.cpe.net.cable.rogers.com.61067: Flags [P.], seq 5432584:5432804, ack 3421, win 501, length 220
17:50:22.196997 IP lamp-ubuntu-s-1vcpu-1gb-tor1-01.ssh > cpef85e42f6a6ce-cmf85e42f6a6cc.cpe.net.cable.rogers.com.61067: Flags [P.], seq 5432804:5433024, ack 3421, win 501, length 220
17:50:22.197051 IP lamp-ubuntu-s-1vcpu-1gb-tor1-01.ssh > cpef85e42f6a6ce-cmf85e42f6a6cc.cpe.net.cable.rogers.com.61067: Flags [P.], seq 5433024:5433244, ack 3421, win 501, length 220
17:50:22.197176 IP lamp-ubuntu-s-1vcpu-1gb-tor1-01.ssh > cpef85e42f6a6ce-cmf85e42f6a6cc.cpe.net.cable.rogers.com.61067: Flags [P.], seq 5433244:5433464, ack 3421, win 501, length 220
17:50:22.197257 IP lamp-ubuntu-s-1vcpu-1gb-tor1-01.ssh > cpef85e42f6a6ce-cmf85e42f6a6cc.cpe.net.cable.rogers.com.61067: Flags [P.], seq 5433464:5433684, ack 3421, win 501, length 220
17:50:22.197317 IP lamp-ubuntu-s-1vcpu-1gb-tor1-01.ssh > cpef85e42f6a6ce-cmf85e42f6a6cc.cpe.net.cable.rogers.com.61067: Flags [P.], seq 5433684:5433904, ack 3421, win 501, length 220
17:50:22.197375 IP lamp-ubuntu-s-1vcpu-1gb-tor1-01.ssh > cpef85e42f6a6ce-cmf85e42f6a6cc.cpe.net.cable.rogers.com.61067: Flags [P.], seq 5433904:5434124, ack 3421, win 501, length 220
17:50:22.197432 IP lamp-ubuntu-s-1vcpu-1gb-tor1-01.ssh > cpef85e42f6a6ce-cmf85e42f6a6cc.cpe.net.cable.rogers.com.61067: Flags [P.], seq 5434124:5434344, ack 3421, win 501, length 220
17:50:22.197486 IP lamp-ubuntu-s-1vcpu-1gb-tor1-01.ssh > cpef85e42f6a6ce-cmf85e42f6a6cc.cpe.net.cable.rogers.com.61067: Flags [P.], seq 5434344:5434564, ack 3421, win 501, length 220
17:50:22.197542 IP lamp-ubuntu-s-1vcpu-1gb-tor1-01.ssh > cpef85e42f6a6ce-cmf85e42f6a6cc.cpe.net.cable.rogers.com.61067: Flags [P.], seq 5434564:5434784, ack 3421, win 501, length 220
17:50:22.197595 IP lamp-ubuntu-s-1vcpu-1gb-tor1-01.ssh > cpef85e42f6a6ce-cmf85e42f6a6cc.cpe.net.cable.rogers.com.61067: Flags [P.], seq 5434784:5435004, ack 3421, win 501, length 220
17:50:22.197648 IP lamp-ubuntu-s-1vcpu-1gb-tor1-01.ssh > cpef85e42f6a6ce-cmf85e42f6a6cc.cpe.net.cable.rogers.com.61067: Flags [P.], seq 5435004:5435224, ack 3421, win 501, length 220
17:50:22.197704 IP lamp-ubuntu-s-1vcpu-1gb-tor1-01.ssh > cpef85e42f6a6ce-cmf85e42f6a6cc.cpe.net.cable.rogers.com.61067: Flags [P.], seq 5435224:5435444, ack 3421, win 501, length 220
17:50:22.197758 IP lamp-ubuntu-s-1vcpu-1gb-tor1-01.ssh > cpef85e42f6a6ce-cmf85e42f6a6cc.cpe.net.cable.rogers.com.61067: Flags [P.], seq 5435444:5435664, ack 3421, win 501, length 220
17:50:22.197811 IP lamp-ubuntu-s-1vcpu-1gb-tor1-01.ssh > cpef85e42f6a6ce-cmf85e42f6a6cc.cpe.net.cable.rogers.com.61067: Flags [P.], seq 5435664:5435884, ack 3421, win 501, length 220
17:50:22.197866 IP lamp-ubuntu-s-1vcpu-1gb-tor1-01.ssh > cpef85e42f6a6ce-cmf85e42f6a6cc.cpe.net.cable.rogers.com.61067: Flags [P.], seq 5435884:5436104, ack 3421, win 501, length 220
17:50:22.197969 IP lamp-ubuntu-s-1vcpu-1gb-tor1-01.ssh > cpef85e42f6a6ce-cmf85e42f6a6cc.cpe.net.cable.rogers.com.61067: Flags [P.], seq 5436104:5436324, ack 3421, win 501, length 220
17:50:22.198034 IP lamp-ubuntu-s-1vcpu-1gb-tor1-01.ssh > cpef85e42f6a6ce-cmf85e42f6a6cc.cpe.net.cable.rogers.com.61067: Flags [P.], seq 5436324:5436544, ack 3421, win 501, length 220
17:50:22.198091 IP lamp-ubuntu-s-1vcpu-1gb-tor1-01.ssh > cpef85e42f6a6ce-cmf85e42f6a6cc.cpe.net.cable.rogers.com.61067: Flags [P.], seq 5436544:5436764, ack 3421, win 501, length 220
17:50:22.198145 IP lamp-ubuntu-s-1vcpu-1gb-tor1-01.ssh > cpef85e42f6a6ce-cmf85e42f6a6cc.cpe.net.cable.rogers.com.61067: Flags [P.], seq 5436764:5436984, ack 3421, win 501, length 220
17:50:22.198198 IP lamp-ubuntu-s-1vcpu-1gb-tor1-01.ssh > cpef85e42f6a6ce-cmf85e42f6a6cc.cpe.net.cable.rogers.com.61067: Flags [P.], seq 5436984:5437204, ack 3421, win 501, length 220
17:50:22.198252 IP lamp-ubuntu-s-1vcpu-1gb-tor1-01.ssh > cpef85e42f6a6ce-cmf85e42f6a6cc.cpe.net.cable.rogers.com.61067: Flags [P.], seq 5437204:5437424, ack 3421, win 501, length 220
17:50:22.198306 IP lamp-ubuntu-s-1vcpu-1gb-tor1-01.ssh > cpef85e42f6a6ce-cmf85e42f6a6cc.cpe.net.cable.rogers.com.61067: Flags [P.], seq 5437424:5437644, ack 3421, win 501, length 220
17:50:22.198364 IP lamp-ubuntu-s-1vcpu-1gb-tor1-01.ssh > cpef85e42f6a6ce-cmf85e42f6a6cc.cpe.net.cable.rogers.com.61067: Flags [P.], seq 5437644:5437864, ack 3421, win 501, length 220
17:50:22.198418 IP lamp-ubuntu-s-1vcpu-1gb-tor1-01.ssh > cpef85e42f6a6ce-cmf85e42f6a6cc.cpe.net.cable.rogers.com.61067: Flags [P.], seq 5437864:5438084, ack 3421, win 501, length 220
17:50:22.198472 IP lamp-ubuntu-s-1vcpu-1gb-tor1-01.ssh > cpef85e42f6a6ce-cmf85e42f6a6cc.cpe.net.cable.rogers.com.61067: Flags [P.], seq 5438084:5438304, ack 3421, win 501, length 220
17:50:22.198529 IP lamp-ubuntu-s-1vcpu-1gb-tor1-01.ssh > cpef85e42f6a6ce-cmf85e42f6a6cc.cpe.net.cable.rogers.com.61067: Flags [P.], seq 5438304:5438524, ack 3421, win 501, length 220
17:50:22.198586 IP lamp-ubuntu-s-1vcpu-1gb-tor1-01.ssh > cpef85e42f6a6ce-cmf85e42f6a6cc.cpe.net.cable.rogers.com.61067: Flags [P.], seq 5438524:5438744, ack 3421, win 501, length 220
17:50:22.198639 IP lamp-ubuntu-s-1vcpu-1gb-tor1-01.ssh > cpef85e42f6a6ce-cmf85e42f6a6cc.cpe.net.cable.rogers.com.61067: Flags [P.], seq 5438744:5438964, ack 3421, win 501, length 220
17:50:22.198696 IP lamp-ubuntu-s-1vcpu-1gb-tor1-01.ssh > cpef85e42f6a6ce-cmf85e42f6a6cc.cpe.net.cable.rogers.com.61067: Flags [P.], seq 5438964:5439184, ack 3421, win 501, length 220
17:50:22.198749 IP lamp-ubuntu-s-1vcpu-1gb-tor1-01.ssh > cpef85e42f6a6ce-cmf85e42f6a6cc.cpe.net.cable.rogers.com.61067: Flags [P.], seq 5439184:5439404, ack 3421, win 501, length 220
17:50:22.198807 IP lamp-ubuntu-s-1vcpu-1gb-tor1-01.ssh > cpef85e42f6a6ce-cmf85e42f6a6cc.cpe.net.cable.rogers.com.61067: Flags [P.], seq 5439404:5439624, ack 3421, win 501, length 220
17:50:22.198861 IP lamp-ubuntu-s-1vcpu-1gb-tor1-01.ssh > cpef85e42f6a6ce-cmf85e42f6a6cc.cpe.net.cable.rogers.com.61067: Flags [P.], seq 5439624:5439844, ack 3421, win 501, length 220
17:50:22.198926 IP lamp-ubuntu-s-1vcpu-1gb-tor1-01.ssh > cpef85e42f6a6ce-cmf85e42f6a6cc.cpe.net.cable.rogers.com.61067: Flags [P.], seq 5439844:5440064, ack 3421, win 501, length 220
17:50:22.198980 IP lamp-ubuntu-s-1vcpu-1gb-tor1-01.ssh > cpef85e42f6a6ce-cmf85e42f6a6cc.cpe.net.cable.rogers.com.61067: Flags [P.], seq 5440064:5440284, ack 3421, win 501, length 220
17:50:22.199035 IP lamp-ubuntu-s-1vcpu-1gb-tor1-01.ssh > cpef85e42f6a6ce-cmf85e42f6a6cc.cpe.net.cable.rogers.com.61067: Flags [P.], seq 5440284:5440504, ack 3421, win 501, length 220
17:50:22.199102 IP lamp-ubuntu-s-1vcpu-1gb-tor1-01.ssh > cpef85e42f6a6ce-cmf85e42f6a6cc.cpe.net.cable.rogers.com.61067: Flags [P.], seq 5440504:5440724, ack 3421, win 501, length 220
17:50:22.199162 IP lamp-ubuntu-s-1vcpu-1gb-tor1-01.ssh > cpef85e42f6a6ce-cmf85e42f6a6cc.cpe.net.cable.rogers.com.61067: Flags [P.], seq 5440724:5440944, ack 3421, win 501, length 220
17:50:22.199248 IP lamp-ubuntu-s-1vcpu-1gb-tor1-01.ssh > cpef85e42f6a6ce-cmf85e42f6a6cc.cpe.net.cable.rogers.com.61067: Flags [P.], seq 5440944:5441164, ack 3421, win 501, length 220
17:50:22.199306 IP lamp-ubuntu-s-1vcpu-1gb-tor1-01.ssh > cpef85e42f6a6ce-cmf85e42f6a6cc.cpe.net.cable.rogers.com.61067: Flags [P.], seq 5441164:5441384, ack 3421, win 501, length 220
17:50:22.199364 IP lamp-ubuntu-s-1vcpu-1gb-tor1-01.ssh > cpef85e42f6a6ce-cmf85e42f6a6cc.cpe.net.cable.rogers.com.61067: Flags [P.], seq 5441384:5441604, ack 3421, win 501, length 220
17:50:22.219917 IP cpef85e42f6a6ce-cmf85e42f6a6cc.cpe.net.cable.rogers.com.61067 > lamp-ubuntu-s-1vcpu-1gb-tor1-01.ssh: Flags [.], ack 5435664, win 1026, length 0
17:50:22.219917 IP cpef85e42f6a6ce-cmf85e42f6a6cc.cpe.net.cable.rogers.com.61067 > lamp-ubuntu-s-1vcpu-1gb-tor1-01.ssh: Flags [.], ack 5441604, win 1021, length 0
17:50:22.220017 IP lamp-ubuntu-s-1vcpu-1gb-tor1-01.ssh > cpef85e42f6a6ce-cmf85e42f6a6cc.cpe.net.cable.rogers.com.61067: Flags [P.], seq 5441604:5441824, ack 3421, win 501, length 220
17:50:22.220288 IP lamp-ubuntu-s-1vcpu-1gb-tor1-01.ssh > cpef85e42f6a6ce-cmf85e42f6a6cc.cpe.net.cable.rogers.com.61067: Flags [P.], seq 5441824:5442372, ack 3421, win 501, length 548
17:50:22.220380 IP lamp-ubuntu-s-1vcpu-1gb-tor1-01.ssh > cpef85e42f6a6ce-cmf85e42f6a6cc.cpe.net.cable.rogers.com.61067: Flags [P.], seq 5442372:5442592, ack 3421, win 501, length 220
17:50:22.220494 IP lamp-ubuntu-s-1vcpu-1gb-tor1-01.ssh > cpef85e42f6a6ce-cmf85e42f6a6cc.cpe.net.cable.rogers.com.61067: Flags [P.], seq 5442592:5442812, ack 3421, win 501, length 220
17:50:22.220582 IP lamp-ubuntu-s-1vcpu-1gb-tor1-01.ssh > cpef85e42f6a6ce-cmf85e42f6a6cc.cpe.net.cable.rogers.com.61067: Flags [P.], seq 5442812:5443032, ack 3421, win 501, length 220
17:50:22.220661 IP lamp-ubuntu-s-1vcpu-1gb-tor1-01.ssh > cpef85e42f6a6ce-cmf85e42f6a6cc.cpe.net.cable.rogers.com.61067: Flags [P.], seq 5443032:5443252, ack 3421, win 501, length 220
17:50:22.220755 IP lamp-ubuntu-s-1vcpu-1gb-tor1-01.ssh > cpef85e42f6a6ce-cmf85e42f6a6cc.cpe.net.cable.rogers.com.61067: Flags [P.], seq 5443252:5443472, ack 3421, win 501, length 220
17:50:22.220846 IP lamp-ubuntu-s-1vcpu-1gb-tor1-01.ssh > cpef85e42f6a6ce-cmf85e42f6a6cc.cpe.net.cable.rogers.com.61067: Flags [P.], seq 5443472:5443692, ack 3421, win 501, length 220
17:50:22.220909 IP lamp-ubuntu-s-1vcpu-1gb-tor1-01.ssh > cpef85e42f6a6ce-cmf85e42f6a6cc.cpe.net.cable.rogers.com.61067: Flags [P.], seq 5443692:5443912, ack 3421, win 501, length 220
17:50:22.220965 IP lamp-ubuntu-s-1vcpu-1gb-tor1-01.ssh > cpef85e42f6a6ce-cmf85e42f6a6cc.cpe.net.cable.rogers.com.61067: Flags [P.], seq 5443912:5444132, ack 3421, win 501, length 220
17:50:22.221021 IP lamp-ubuntu-s-1vcpu-1gb-tor1-01.ssh > cpef85e42f6a6ce-cmf85e42f6a6cc.cpe.net.cable.rogers.com.61067: Flags [P.], seq 5444132:5444352, ack 3421, win 501, length 220
17:50:22.221081 IP lamp-ubuntu-s-1vcpu-1gb-tor1-01.ssh > cpef85e42f6a6ce-cmf85e42f6a6cc.cpe.net.cable.rogers.com.61067: Flags [P.], seq 5444352:5444572, ack 3421, win 501, length 220
17:50:22.221152 IP lamp-ubuntu-s-1vcpu-1gb-tor1-01.ssh > cpef85e42f6a6ce-cmf85e42f6a6cc.cpe.net.cable.rogers.com.61067: Flags [P.], seq 5444572:5444792, ack 3421, win 501, length 220
17:50:22.221208 IP lamp-ubuntu-s-1vcpu-1gb-tor1-01.ssh > cpef85e42f6a6ce-cmf85e42f6a6cc.cpe.net.cable.rogers.com.61067: Flags [P.], seq 5444792:5445012, ack 3421, win 501, length 220
17:50:22.221293 IP lamp-ubuntu-s-1vcpu-1gb-tor1-01.ssh > cpef85e42f6a6ce-cmf85e42f6a6cc.cpe.net.cable.rogers.com.61067: Flags [P.], seq 5445012:5445232, ack 3421, win 501, length 220
17:50:22.221374 IP lamp-ubuntu-s-1vcpu-1gb-tor1-01.ssh > cpef85e42f6a6ce-cmf85e42f6a6cc.cpe.net.cable.rogers.com.61067: Flags [P.], seq 5445232:5445452, ack 3421, win 501, length 220
17:50:22.221463 IP lamp-ubuntu-s-1vcpu-1gb-tor1-01.ssh > cpef85e42f6a6ce-cmf85e42f6a6cc.cpe.net.cable.rogers.com.61067: Flags [P.], seq 5445452:5445672, ack 3421, win 501, length 220
17:50:22.221530 IP lamp-ubuntu-s-1vcpu-1gb-tor1-01.ssh > cpef85e42f6a6ce-cmf85e42f6a6cc.cpe.net.cable.rogers.com.61067: Flags [P.], seq 5445672:5445892, ack 3421, win 501, length 220
17:50:22.221586 IP lamp-ubuntu-s-1vcpu-1gb-tor1-01.ssh > cpef85e42f6a6ce-cmf85e42f6a6cc.cpe.net.cable.rogers.com.61067: Flags [P.], seq 5445892:5446112, ack 3421, win 501, length 220
17:50:22.221645 IP lamp-ubuntu-s-1vcpu-1gb-tor1-01.ssh > cpef85e42f6a6ce-cmf85e42f6a6cc.cpe.net.cable.rogers.com.61067: Flags [P.], seq 5446112:5446332, ack 3421, win 501, length 220
17:50:22.221710 IP lamp-ubuntu-s-1vcpu-1gb-tor1-01.ssh > cpef85e42f6a6ce-cmf85e42f6a6cc.cpe.net.cable.rogers.com.61067: Flags [P.], seq 5446332:5446552, ack 3421, win 501, length 220
17:50:22.221768 IP lamp-ubuntu-s-1vcpu-1gb-tor1-01.ssh > cpef85e42f6a6ce-cmf85e42f6a6cc.cpe.net.cable.rogers.com.61067: Flags [P.], seq 5446552:5446772, ack 3421, win 501, length 220
17:50:22.221827 IP lamp-ubuntu-s-1vcpu-1gb-tor1-01.ssh > cpef85e42f6a6ce-cmf85e42f6a6cc.cpe.net.cable.rogers.com.61067: Flags [P.], seq 5446772:5446992, ack 3421, win 501, length 220
17:50:22.221882 IP lamp-ubuntu-s-1vcpu-1gb-tor1-01.ssh > cpef85e42f6a6ce-cmf85e42f6a6cc.cpe.net.cable.rogers.com.61067: Flags [P.], seq 5446992:5447212, ack 3421, win 501, length 220
17:50:22.221936 IP lamp-ubuntu-s-1vcpu-1gb-tor1-01.ssh > cpef85e42f6a6ce-cmf85e42f6a6cc.cpe.net.cable.rogers.com.61067: Flags [P.], seq 5447212:5447432, ack 3421, win 501, length 220
17:50:22.221993 IP lamp-ubuntu-s-1vcpu-1gb-tor1-01.ssh > cpef85e42f6a6ce-cmf85e42f6a6cc.cpe.net.cable.rogers.com.61067: Flags [P.], seq 5447432:5447652, ack 3421, win 501, length 220
17:50:22.222048 IP lamp-ubuntu-s-1vcpu-1gb-tor1-01.ssh > cpef85e42f6a6ce-cmf85e42f6a6cc.cpe.net.cable.rogers.com.61067: Flags [P.], seq 5447652:5447872, ack 3421, win 501, length 220
17:50:22.222103 IP lamp-ubuntu-s-1vcpu-1gb-tor1-01.ssh > cpef85e42f6a6ce-cmf85e42f6a6cc.cpe.net.cable.rogers.com.61067: Flags [P.], seq 5447872:5448092, ack 3421, win 501, length 220
17:50:22.222159 IP lamp-ubuntu-s-1vcpu-1gb-tor1-01.ssh > cpef85e42f6a6ce-cmf85e42f6a6cc.cpe.net.cable.rogers.com.61067: Flags [P.], seq 5448092:5448312, ack 3421, win 501, length 220
17:50:22.222213 IP lamp-ubuntu-s-1vcpu-1gb-tor1-01.ssh > cpef85e42f6a6ce-cmf85e42f6a6cc.cpe.net.cable.rogers.com.61067: Flags [P.], seq 5448312:5448532, ack 3421, win 501, length 220
17:50:22.222272 IP lamp-ubuntu-s-1vcpu-1gb-tor1-01.ssh > cpef85e42f6a6ce-cmf85e42f6a6cc.cpe.net.cable.rogers.com.61067: Flags [P.], seq 5448532:5448752, ack 3421, win 501, length 220
17:50:22.222328 IP lamp-ubuntu-s-1vcpu-1gb-tor1-01.ssh > cpef85e42f6a6ce-cmf85e42f6a6cc.cpe.net.cable.rogers.com.61067: Flags [P.], seq 5448752:5448972, ack 3421, win 501, length 220
17:50:22.222412 IP lamp-ubuntu-s-1vcpu-1gb-tor1-01.ssh > cpef85e42f6a6ce-cmf85e42f6a6cc.cpe.net.cable.rogers.com.61067: Flags [P.], seq 5448972:5449192, ack 3421, win 501, length 220
17:50:22.222499 IP lamp-ubuntu-s-1vcpu-1gb-tor1-01.ssh > cpef85e42f6a6ce-cmf85e42f6a6cc.cpe.net.cable.rogers.com.61067: Flags [P.], seq 5449192:5449412, ack 3421, win 501, length 220
17:50:22.222585 IP lamp-ubuntu-s-1vcpu-1gb-tor1-01.ssh > cpef85e42f6a6ce-cmf85e42f6a6cc.cpe.net.cable.rogers.com.61067: Flags [P.], seq 5449412:5449632, ack 3421, win 501, length 220
17:50:22.222647 IP lamp-ubuntu-s-1vcpu-1gb-tor1-01.ssh > cpef85e42f6a6ce-cmf85e42f6a6cc.cpe.net.cable.rogers.com.61067: Flags [P.], seq 5449632:5449852, ack 3421, win 501, length 220
17:50:22.222706 IP lamp-ubuntu-s-1vcpu-1gb-tor1-01.ssh > cpef85e42f6a6ce-cmf85e42f6a6cc.cpe.net.cable.rogers.com.61067: Flags [P.], seq 5449852:5450072, ack 3421, win 501, length 220
17:50:22.222769 IP lamp-ubuntu-s-1vcpu-1gb-tor1-01.ssh > cpef85e42f6a6ce-cmf85e42f6a6cc.cpe.net.cable.rogers.com.61067: Flags [P.], seq 5450072:5450292, ack 3421, win 501, length 220
17:50:22.222826 IP lamp-ubuntu-s-1vcpu-1gb-tor1-01.ssh > cpef85e42f6a6ce-cmf85e42f6a6cc.cpe.net.cable.rogers.com.61067: Flags [P.], seq 5450292:5450512, ack 3421, win 501, length 220
17:50:22.222884 IP lamp-ubuntu-s-1vcpu-1gb-tor1-01.ssh > cpef85e42f6a6ce-cmf85e42f6a6cc.cpe.net.cable.rogers.com.61067: Flags [P.], seq 5450512:5450732, ack 3421, win 501, length 220
17:50:22.222938 IP lamp-ubuntu-s-1vcpu-1gb-tor1-01.ssh > cpef85e42f6a6ce-cmf85e42f6a6cc.cpe.net.cable.rogers.com.61067: Flags [P.], seq 5450732:5450952, ack 3421, win 501, length 220
17:50:22.222992 IP lamp-ubuntu-s-1vcpu-1gb-tor1-01.ssh > cpef85e42f6a6ce-cmf85e42f6a6cc.cpe.net.cable.rogers.com.61067: Flags [P.], seq 5450952:5451172, ack 3421, win 501, length 220
17:50:22.223047 IP lamp-ubuntu-s-1vcpu-1gb-tor1-01.ssh > cpef85e42f6a6ce-cmf85e42f6a6cc.cpe.net.cable.rogers.com.61067: Flags [P.], seq 5451172:5451392, ack 3421, win 501, length 220
17:50:22.223113 IP lamp-ubuntu-s-1vcpu-1gb-tor1-01.ssh > cpef85e42f6a6ce-cmf85e42f6a6cc.cpe.net.cable.rogers.com.61067: Flags [P.], seq 5451392:5451612, ack 3421, win 501, length 220
17:50:22.223173 IP lamp-ubuntu-s-1vcpu-1gb-tor1-01.ssh > cpef85e42f6a6ce-cmf85e42f6a6cc.cpe.net.cable.rogers.com.61067: Flags [P.], seq 5451612:5451832, ack 3421, win 501, length 220
17:50:22.223231 IP lamp-ubuntu-s-1vcpu-1gb-tor1-01.ssh > cpef85e42f6a6ce-cmf85e42f6a6cc.cpe.net.cable.rogers.com.61067: Flags [P.], seq 5451832:5452052, ack 3421, win 501, length 220
17:50:22.223285 IP lamp-ubuntu-s-1vcpu-1gb-tor1-01.ssh > cpef85e42f6a6ce-cmf85e42f6a6cc.cpe.net.cable.rogers.com.61067: Flags [P.], seq 5452052:5452272, ack 3421, win 501, length 220
17:50:22.223338 IP lamp-ubuntu-s-1vcpu-1gb-tor1-01.ssh > cpef85e42f6a6ce-cmf85e42f6a6cc.cpe.net.cable.rogers.com.61067: Flags [P.], seq 5452272:5452492, ack 3421, win 501, length 220
17:50:22.224102 IP lamp-ubuntu-s-1vcpu-1gb-tor1-01.ssh > cpef85e42f6a6ce-cmf85e42f6a6cc.cpe.net.cable.rogers.com.61067: Flags [P.], seq 5452492:5452712, ack 3421, win 501, length 220
17:50:22.224171 IP lamp-ubuntu-s-1vcpu-1gb-tor1-01.ssh > cpef85e42f6a6ce-cmf85e42f6a6cc.cpe.net.cable.rogers.com.61067: Flags [P.], seq 5452712:5452932, ack 3421, win 501, length 220
17:50:22.224238 IP lamp-ubuntu-s-1vcpu-1gb-tor1-01.ssh > cpef85e42f6a6ce-cmf85e42f6a6cc.cpe.net.cable.rogers.com.61067: Flags [P.], seq 5452932:5453152, ack 3421, win 501, length 220
17:50:22.224293 IP lamp-ubuntu-s-1vcpu-1gb-tor1-01.ssh > cpef85e42f6a6ce-cmf85e42f6a6cc.cpe.net.cable.rogers.com.61067: Flags [P.], seq 5453152:5453372, ack 3421, win 501, length 220
17:50:22.224347 IP lamp-ubuntu-s-1vcpu-1gb-tor1-01.ssh > cpef85e42f6a6ce-cmf85e42f6a6cc.cpe.net.cable.rogers.com.61067: Flags [P.], seq 5453372:5453592, ack 3421, win 501, length 220
17:50:22.224400 IP lamp-ubuntu-s-1vcpu-1gb-tor1-01.ssh > cpef85e42f6a6ce-cmf85e42f6a6cc.cpe.net.cable.rogers.com.61067: Flags [P.], seq 5453592:5453812, ack 3421, win 501, length 220
17:50:22.224457 IP lamp-ubuntu-s-1vcpu-1gb-tor1-01.ssh > cpef85e42f6a6ce-cmf85e42f6a6cc.cpe.net.cable.rogers.com.61067: Flags [P.], seq 5453812:5454032, ack 3421, win 501, length 220
17:50:22.224511 IP lamp-ubuntu-s-1vcpu-1gb-tor1-01.ssh > cpef85e42f6a6ce-cmf85e42f6a6cc.cpe.net.cable.rogers.com.61067: Flags [P.], seq 5454032:5454252, ack 3421, win 501, length 220
17:50:22.224565 IP lamp-ubuntu-s-1vcpu-1gb-tor1-01.ssh > cpef85e42f6a6ce-cmf85e42f6a6cc.cpe.net.cable.rogers.com.61067: Flags [P.], seq 5454252:5454472, ack 3421, win 501, length 220
17:50:22.224652 IP lamp-ubuntu-s-1vcpu-1gb-tor1-01.ssh > cpef85e42f6a6ce-cmf85e42f6a6cc.cpe.net.cable.rogers.com.61067: Flags [P.], seq 5454472:5454692, ack 3421, win 501, length 220
17:50:22.224742 IP lamp-ubuntu-s-1vcpu-1gb-tor1-01.ssh > cpef85e42f6a6ce-cmf85e42f6a6cc.cpe.net.cable.rogers.com.61067: Flags [P.], seq 5454692:5454912, ack 3421, win 501, length 220
17:50:22.224817 IP lamp-ubuntu-s-1vcpu-1gb-tor1-01.ssh > cpef85e42f6a6ce-cmf85e42f6a6cc.cpe.net.cable.rogers.com.61067: Flags [P.], seq 5454912:5455132, ack 3421, win 501, length 220
17:50:22.224906 IP lamp-ubuntu-s-1vcpu-1gb-tor1-01.ssh > cpef85e42f6a6ce-cmf85e42f6a6cc.cpe.net.cable.rogers.com.61067: Flags [P.], seq 5455132:5455352, ack 3421, win 501, length 220
17:50:22.224997 IP lamp-ubuntu-s-1vcpu-1gb-tor1-01.ssh > cpef85e42f6a6ce-cmf85e42f6a6cc.cpe.net.cable.rogers.com.61067: Flags [P.], seq 5455352:5455572, ack 3421, win 501, length 220
17:50:22.225084 IP lamp-ubuntu-s-1vcpu-1gb-tor1-01.ssh > cpef85e42f6a6ce-cmf85e42f6a6cc.cpe.net.cable.rogers.com.61067: Flags [P.], seq 5455572:5455792, ack 3421, win 501, length 220
17:50:22.225180 IP lamp-ubuntu-s-1vcpu-1gb-tor1-01.ssh > cpef85e42f6a6ce-cmf85e42f6a6cc.cpe.net.cable.rogers.com.61067: Flags [P.], seq 5455792:5456012, ack 3421, win 501, length 220
17:50:22.225260 IP lamp-ubuntu-s-1vcpu-1gb-tor1-01.ssh > cpef85e42f6a6ce-cmf85e42f6a6cc.cpe.net.cable.rogers.com.61067: Flags [P.], seq 5456012:5456232, ack 3421, win 501, length 220
17:50:22.225329 IP lamp-ubuntu-s-1vcpu-1gb-tor1-01.ssh > cpef85e42f6a6ce-cmf85e42f6a6cc.cpe.net.cable.rogers.com.61067: Flags [P.], seq 5456232:5456452, ack 3421, win 501, length 220
17:50:22.225388 IP lamp-ubuntu-s-1vcpu-1gb-tor1-01.ssh > cpef85e42f6a6ce-cmf85e42f6a6cc.cpe.net.cable.rogers.com.61067: Flags [P.], seq 5456452:5456672, ack 3421, win 501, length 220
17:50:22.225443 IP lamp-ubuntu-s-1vcpu-1gb-tor1-01.ssh > cpef85e42f6a6ce-cmf85e42f6a6cc.cpe.net.cable.rogers.com.61067: Flags [P.], seq 5456672:5456892, ack 3421, win 501, length 220
17:50:22.225506 IP lamp-ubuntu-s-1vcpu-1gb-tor1-01.ssh > cpef85e42f6a6ce-cmf85e42f6a6cc.cpe.net.cable.rogers.com.61067: Flags [P.], seq 5456892:5457112, ack 3421, win 501, length 220
17:50:22.225563 IP lamp-ubuntu-s-1vcpu-1gb-tor1-01.ssh > cpef85e42f6a6ce-cmf85e42f6a6cc.cpe.net.cable.rogers.com.61067: Flags [P.], seq 5457112:5457332, ack 3421, win 501, length 220
17:50:22.233442 IP cpef85e42f6a6ce-cmf85e42f6a6cc.cpe.net.cable.rogers.com.61067 > lamp-ubuntu-s-1vcpu-1gb-tor1-01.ssh: Flags [.], ack 5449192, win 1021, length 0
17:50:22.233507 IP lamp-ubuntu-s-1vcpu-1gb-tor1-01.ssh > cpef85e42f6a6ce-cmf85e42f6a6cc.cpe.net.cable.rogers.com.61067: Flags [P.], seq 5457332:5457552, ack 3421, win 501, length 220
17:50:22.233656 IP lamp-ubuntu-s-1vcpu-1gb-tor1-01.ssh > cpef85e42f6a6ce-cmf85e42f6a6cc.cpe.net.cable.rogers.com.61067: Flags [P.], seq 5457552:5457940, ack 3421, win 501, length 388
17:50:22.233727 IP lamp-ubuntu-s-1vcpu-1gb-tor1-01.ssh > cpef85e42f6a6ce-cmf85e42f6a6cc.cpe.net.cable.rogers.com.61067: Flags [P.], seq 5457940:5458160, ack 3421, win 501, length 220
17:50:22.233790 IP lamp-ubuntu-s-1vcpu-1gb-tor1-01.ssh > cpef85e42f6a6ce-cmf85e42f6a6cc.cpe.net.cable.rogers.com.61067: Flags [P.], seq 5458160:5458380, ack 3421, win 501, length 220
17:50:22.233848 IP lamp-ubuntu-s-1vcpu-1gb-tor1-01.ssh > cpef85e42f6a6ce-cmf85e42f6a6cc.cpe.net.cable.rogers.com.61067: Flags [P.], seq 5458380:5458600, ack 3421, win 501, length 220
17:50:22.233917 IP lamp-ubuntu-s-1vcpu-1gb-tor1-01.ssh > cpef85e42f6a6ce-cmf85e42f6a6cc.cpe.net.cable.rogers.com.61067: Flags [P.], seq 5458600:5458820, ack 3421, win 501, length 220
17:50:22.233973 IP lamp-ubuntu-s-1vcpu-1gb-tor1-01.ssh > cpef85e42f6a6ce-cmf85e42f6a6cc.cpe.net.cable.rogers.com.61067: Flags [P.], seq 5458820:5459040, ack 3421, win 501, length 220
17:50:22.234028 IP lamp-ubuntu-s-1vcpu-1gb-tor1-01.ssh > cpef85e42f6a6ce-cmf85e42f6a6cc.cpe.net.cable.rogers.com.61067: Flags [P.], seq 5459040:5459260, ack 3421, win 501, length 220
17:50:22.234084 IP lamp-ubuntu-s-1vcpu-1gb-tor1-01.ssh > cpef85e42f6a6ce-cmf85e42f6a6cc.cpe.net.cable.rogers.com.61067: Flags [P.], seq 5459260:5459480, ack 3421, win 501, length 220
17:50:22.234140 IP lamp-ubuntu-s-1vcpu-1gb-tor1-01.ssh > cpef85e42f6a6ce-cmf85e42f6a6cc.cpe.net.cable.rogers.com.61067: Flags [P.], seq 5459480:5459700, ack 3421, win 501, length 220
17:50:22.234194 IP lamp-ubuntu-s-1vcpu-1gb-tor1-01.ssh > cpef85e42f6a6ce-cmf85e42f6a6cc.cpe.net.cable.rogers.com.61067: Flags [P.], seq 5459700:5459920, ack 3421, win 501, length 220
17:50:22.234248 IP lamp-ubuntu-s-1vcpu-1gb-tor1-01.ssh > cpef85e42f6a6ce-cmf85e42f6a6cc.cpe.net.cable.rogers.com.61067: Flags [P.], seq 5459920:5460140, ack 3421, win 501, length 220
17:50:22.234304 IP lamp-ubuntu-s-1vcpu-1gb-tor1-01.ssh > cpef85e42f6a6ce-cmf85e42f6a6cc.cpe.net.cable.rogers.com.61067: Flags [P.], seq 5460140:5460360, ack 3421, win 501, length 220
17:50:22.234359 IP lamp-ubuntu-s-1vcpu-1gb-tor1-01.ssh > cpef85e42f6a6ce-cmf85e42f6a6cc.cpe.net.cable.rogers.com.61067: Flags [P.], seq 5460360:5460580, ack 3421, win 501, length 220
17:50:22.234449 IP lamp-ubuntu-s-1vcpu-1gb-tor1-01.ssh > cpef85e42f6a6ce-cmf85e42f6a6cc.cpe.net.cable.rogers.com.61067: Flags [P.], seq 5460580:5460800, ack 3421, win 501, length 220
17:50:22.234525 IP lamp-ubuntu-s-1vcpu-1gb-tor1-01.ssh > cpef85e42f6a6ce-cmf85e42f6a6cc.cpe.net.cable.rogers.com.61067: Flags [P.], seq 5460800:5461020, ack 3421, win 501, length 220
17:50:22.234593 IP lamp-ubuntu-s-1vcpu-1gb-tor1-01.ssh > cpef85e42f6a6ce-cmf85e42f6a6cc.cpe.net.cable.rogers.com.61067: Flags [P.], seq 5461020:5461240, ack 3421, win 501, length 220
17:50:22.234650 IP lamp-ubuntu-s-1vcpu-1gb-tor1-01.ssh > cpef85e42f6a6ce-cmf85e42f6a6cc.cpe.net.cable.rogers.com.61067: Flags [P.], seq 5461240:5461460, ack 3421, win 501, length 220
17:50:22.234705 IP lamp-ubuntu-s-1vcpu-1gb-tor1-01.ssh > cpef85e42f6a6ce-cmf85e42f6a6cc.cpe.net.cable.rogers.com.61067: Flags [P.], seq 5461460:5461680, ack 3421, win 501, length 220
17:50:22.234761 IP lamp-ubuntu-s-1vcpu-1gb-tor1-01.ssh > cpef85e42f6a6ce-cmf85e42f6a6cc.cpe.net.cable.rogers.com.61067: Flags [P.], seq 5461680:5461900, ack 3421, win 501, length 220
17:50:22.234815 IP lamp-ubuntu-s-1vcpu-1gb-tor1-01.ssh > cpef85e42f6a6ce-cmf85e42f6a6cc.cpe.net.cable.rogers.com.61067: Flags [P.], seq 5461900:5462120, ack 3421, win 501, length 220
17:50:22.234868 IP lamp-ubuntu-s-1vcpu-1gb-tor1-01.ssh > cpef85e42f6a6ce-cmf85e42f6a6cc.cpe.net.cable.rogers.com.61067: Flags [P.], seq 5462120:5462340, ack 3421, win 501, length 220
17:50:22.234921 IP lamp-ubuntu-s-1vcpu-1gb-tor1-01.ssh > cpef85e42f6a6ce-cmf85e42f6a6cc.cpe.net.cable.rogers.com.61067: Flags [P.], seq 5462340:5462560, ack 3421, win 501, length 220
17:50:22.234979 IP lamp-ubuntu-s-1vcpu-1gb-tor1-01.ssh > cpef85e42f6a6ce-cmf85e42f6a6cc.cpe.net.cable.rogers.com.61067: Flags [P.], seq 5462560:5462780, ack 3421, win 501, length 220
17:50:22.235032 IP lamp-ubuntu-s-1vcpu-1gb-tor1-01.ssh > cpef85e42f6a6ce-cmf85e42f6a6cc.cpe.net.cable.rogers.com.61067: Flags [P.], seq 5462780:5463000, ack 3421, win 501, length 220
17:50:22.235099 IP lamp-ubuntu-s-1vcpu-1gb-tor1-01.ssh > cpef85e42f6a6ce-cmf85e42f6a6cc.cpe.net.cable.rogers.com.61067: Flags [P.], seq 5463000:5463220, ack 3421, win 501, length 220
17:50:22.235157 IP lamp-ubuntu-s-1vcpu-1gb-tor1-01.ssh > cpef85e42f6a6ce-cmf85e42f6a6cc.cpe.net.cable.rogers.com.61067: Flags [P.], seq 5463220:5463440, ack 3421, win 501, length 220
17:50:22.235236 IP lamp-ubuntu-s-1vcpu-1gb-tor1-01.ssh > cpef85e42f6a6ce-cmf85e42f6a6cc.cpe.net.cable.rogers.com.61067: Flags [P.], seq 5463440:5463660, ack 3421, win 501, length 220
17:50:22.235330 IP lamp-ubuntu-s-1vcpu-1gb-tor1-01.ssh > cpef85e42f6a6ce-cmf85e42f6a6cc.cpe.net.cable.rogers.com.61067: Flags [P.], seq 5463660:5463880, ack 3421, win 501, length 220
17:50:22.235396 IP lamp-ubuntu-s-1vcpu-1gb-tor1-01.ssh > cpef85e42f6a6ce-cmf85e42f6a6cc.cpe.net.cable.rogers.com.61067: Flags [P.], seq 5463880:5464100, ack 3421, win 501, length 220
